<?xml version="1.0" encoding="UTF-8"?>
<!--
To change this license header, choose License Headers in Project Properties.
To change this template file, choose Tools | Templates
and open the template in the editor.
-->


<ns1:categories
    xmlns:xsi='http://www.w3.org/2001/XMLSchema-instance'
    xmlns:ns1='http://xml.netbeans.org/schema/categories'
    xsi:schemaLocation='http://xml.netbeans.org/schema/categories categories.xsd'>
    <category>
        <name>gffs</name>
        <link>sefesfesf</link>
    </category>
    <category>
        <name>fesfesf</name>
        <link>esffesf</link>
    </category>
    <category>
        <name>esfsef</name>
        <link>fesfes</link>
    </category>
</ns1:categories>
